{
  "code_commit": "68e2670bfa16e44bd25dedc662073acfa690bd72",
  "concept_catalog_sha256": "57dff640761ba61e110c04f913d6473a95d94a233f8d0c77f38b5d7638d8d009",
  "contract_id": "decomposition-llama-dev-contract-6fbe47fd0e9f79ba",
  "contract_sha256": "6fbe47fd0e9f79ba24f416728108fa47432389bdcee047f4139566f6bb242c27",
  "generated_at": "2026-09-02T11:14:19.941974Z",
  "model_id": "ollama/llama3.1:8b-instruct-q4_k_m@sha256:46e0c10c039e019119339687c3c1757cc81b9da49709a3b3924863ba87ca666e",
  "performance": {
    "hardware": {
      "architecture": "arm64",
      "chip": "Apple M3",
      "cpu_cores": 8,
      "memory_bytes": 25769803776,
      "system": "Darwin"
    },
    "latency_seconds_mean": 140.33337843228946,
    "latency_seconds_p95": 552.9649343329947,
    "output_tokens": 22212,
    "prompt_tokens": 136131,
    "request_count": 40,
    "total_duration_seconds": 5613.335137291579
  },
  "prediction_id": "decomposition-llama-predictions-dev-130da5c6941b9413",
  "prediction_sha256": "130da5c6941b9413e9df0e2f5ce6520fdd32a80d806016d5761f43dcb2d4713b",
  "prediction_version": "1.0.0",
  "predictions": [
    {
      "criterion_id": "nct02932007-exclusion-04393439bf6f2032",
      "expression": {
        "atom": {
          "condition_id": "nct02932007-exclusion-04393439bf6f2032:a01",
          "expected": {
            "value": false,
            "value_type": "boolean"
          },
          "fact_selection": "all",
          "field": "investigator_protocol_interference_assessment",
          "operator": ">",
          "provenance": {
            "method": "llm",
            "model_id": "ollama/llama3.1:8b-instruct-q4_k_m@sha256:46e0c10c039e019119339687c3c1757cc81b9da49709a3b3924863ba87ca666e",
            "prompt_version": "clinicalmatcher-decomposition-local-llama/1.0.0",
            "source_id": "clinicaltrials.gov:NCT02932007:eligibility:2019-08-19:b4cf469ca0bd",
            "source_span": {
              "end": 123,
              "start": 0
            }
          }
        },
        "expression_type": "atom"
      },
      "failure_reason": "boolean atom requires == or !=",
      "latency_seconds": 63.395490542054176,
      "nct_id": "NCT02932007",
      "output_status": "semantic_invalid",
      "output_tokens": 257,
      "prompt_tokens": 3488
    },
    {
      "criterion_id": "nct02932007-inclusion-3449060b23561f00",
      "expression": null,
      "failure_reason": "invalid_json",
      "latency_seconds": 590.3489080830477,
      "nct_id": "NCT02932007",
      "output_status": "schema_invalid",
      "output_tokens": 4096,
      "prompt_tokens": 3502
    },
    {
      "criterion_id": "nct02932007-inclusion-9fa662d9d6bd53f7",
      "expression": null,
      "failure_reason": "invalid_json",
      "latency_seconds": 552.9649343329947,
      "nct_id": "NCT02932007",
      "output_status": "schema_invalid",
      "output_tokens": 4096,
      "prompt_tokens": 3526
    },
    {
      "criterion_id": "nct02932007-inclusion-a87b29150a5fc629",
      "expression": {
        "atom": {
          "condition_id": "nct02932007-inclusion-a87b29150a5fc629:a01",
          "expected": {
            "value": true,
            "value_type": "boolean"
          },
          "fact_selection": "all",
          "field": "investigator_stroke_prevention_assessment",
          "operator": ">",
          "provenance": {
            "method": "llm",
            "model_id": "ollama/llama3.1:8b-instruct-q4_k_m@sha256:46e0c10c039e019119339687c3c1757cc81b9da49709a3b3924863ba87ca666e",
            "prompt_version": "clinicalmatcher-decomposition-local-llama/1.0.0",
            "source_id": "clinicaltrials.gov:NCT02932007:eligibility:2019-08-19:b4cf469ca0bd",
            "source_span": {
              "end": 123,
              "start": 0
            }
          }
        },
        "expression_type": "atom"
      },
      "failure_reason": "boolean atom requires == or !=",
      "latency_seconds": 100.02377083408646,
      "nct_id": "NCT02932007",
      "output_status": "semantic_invalid",
      "output_tokens": 257,
      "prompt_tokens": 3485
    },
    {
      "criterion_id": "nct02932007-inclusion-ce4fe9d7f97194cb",
      "expression": {
        "children": [
          {
            "atom": {
              "condition_id": "nct02932007-inclusion-ce4fe9d7f97194cb:a01",
              "expected": {
                "value": true,
                "value_type": "boolean"
              },
              "fact_selection": "all",
              "field": "cardiac_rhythm_monitoring_device",
              "operator": "==",
              "provenance": {
                "method": "llm",
                "model_id": "ollama/llama3.1:8b-instruct-q4_k_m@sha256:46e0c10c039e019119339687c3c1757cc81b9da49709a3b3924863ba87ca666e",
                "prompt_version": "clinicalmatcher-decomposition-local-llama/1.0.0",
                "source_id": "clinicaltrials.gov:NCT02932007:eligibility:2019-08-19:b4cf469ca0bd",
                "source_span": {
                  "end": 34,
                  "start": 0
                }
              }
            },
            "expression_type": "atom"
          },
          {
            "atom": {
              "condition_id": "nct02932007-inclusion-ce4fe9d7f97194cb:a02",
              "expected": {
                "value": true,
                "value_type": "boolean"
              },
              "fact_selection": "all",
              "field": "event_monitor_willingness",
              "operator": "==",
              "provenance": {
                "method": "llm",
                "model_id": "ollama/llama3.1:8b-instruct-q4_k_m@sha256:46e0c10c039e019119339687c3c1757cc81b9da49709a3b3924863ba87ca666e",
                "prompt_version": "clinicalmatcher-decomposition-local-llama/1.0.0",
                "source_id": "clinicaltrials.gov:NCT02932007:eligibility:2019-08-19:b4cf469ca0bd",
                "source_span": {
                  "end": 63,
                  "start": 35
                }
              }
            },
            "expression_type": "atom"
          },
          {
            "atom": {
              "condition_id": "nct02932007-inclusion-ce4fe9d7f97194cb:a03",
              "expected": {
                "value": false,
                "value_type": "boolean"
              },
              "fact_selection": "all",
              "field": "cardiac_rhythm_monitoring_device",
              "operator": "==",
              "provenance": {
                "method": "llm",
                "model_id": "ollama/llama3.1:8b-instruct-q4_k_m@sha256:46e0c10c039e019119339687c3c1757cc81b9da49709a3b3924863ba87ca666e",
                "prompt_version": "clinicalmatcher-decomposition-local-llama/1.0.0",
                "source_id": "clinicaltrials.gov:NCT02932007:eligibility:2019-08-19:b4cf469ca0bd",
                "source_span": {
                  "end": 96,
                  "start": 64
                }
              }
            },
            "expression_type": "atom"
          }
        ],
        "expression_type": "all"
      },
      "failure_reason": "Boolean atoms must state a positive fact with expected=true; represent negation with NOT",
      "latency_seconds": 180.25676329201087,
      "nct_id": "NCT02932007",
      "output_status": "semantic_invalid",
      "output_tokens": 773,
      "prompt_tokens": 3502
    },
    {
      "criterion_id": "nct05136131-exclusion-2f16526f17fb2859",
      "expression": {
        "atom": {
          "condition_id": "nct05136131-exclusion-2f16526f17fb2859:a01",
          "expected": {
            "value": false,
            "value_type": "boolean"
          },
          "fact_selection": "all",
          "field": "investigator_patient_interest_assessment",
          "operator": "!=",
          "provenance": {
            "method": "llm",
            "model_id": "ollama/llama3.1:8b-instruct-q4_k_m@sha256:46e0c10c039e019119339687c3c1757cc81b9da49709a3b3924863ba87ca666e",
            "prompt_version": "clinicalmatcher-decomposition-local-llama/1.0.0",
            "source_id": "clinicaltrials.gov:NCT05136131:eligibility:2026-07-01:42a8201cb6a7",
            "source_span": {
              "end": 13,
              "start": 0
            }
          }
        },
        "expression_type": "atom"
      },
      "failure_reason": "Boolean atoms must state a positive fact with expected=true; represent negation with NOT",
      "latency_seconds": 75.80284941685386,
      "nct_id": "NCT05136131",
      "output_status": "semantic_invalid",
      "output_tokens": 260,
      "prompt_tokens": 3481
    },
    {
      "criterion_id": "nct05860894-inclusion-83b4b84c3a0bc30e",
      "expression": {
        "atom": {
          "condition_id": "nct05860894-inclusion-83b4b84c3a0bc30e:a01",
          "expected": {
            "value": true,
            "value_type": "boolean"
          },
          "fact_selection": "all",
          "field": "informed_consent",
          "operator": "==",
          "provenance": {
            "method": "llm",
            "model_id": "ollama/llama3.1:8b-instruct-q4_k_m@sha256:46e0c10c039e019119339687c3c1757cc81b9da49709a3b3924863ba87ca666e",
            "prompt_version": "clinicalmatcher-decomposition-local-llama/1.0.0",
            "source_id": "clinicaltrials.gov:NCT05860894:eligibility:2024-02-01:a338254941c9",
            "source_span": {
              "end": 24,
              "start": 0
            }
          }
        },
        "expression_type": "atom"
      },
      "failure_reason": null,
      "latency_seconds": 75.04131470806897,
      "nct_id": "NCT05860894",
      "output_status": "valid",
      "output_tokens": 257,
      "prompt_tokens": 3464
    },
    {
      "criterion_id": "nct05860894-inclusion-93f9b176abd4e08d",
      "expression": {
        "atom": {
          "condition_id": "nct05860894-inclusion-93f9b176abd4e08d:a01",
          "expected": {
            "value": 18,
            "value_type": "number"
          },